{
  "schema_version": "2.0",
  "tool": "dataqmonitor",
  "dataset": "Synthetic supplier delivery feed",
  "evaluated_at": "2026-10-13T12:00:00+00:00",
  "synthetic": true,
  "status": "unknown",
  "decision": {
    "outcome": "undetermined",
    "scope": "supplied_observations",
    "required_checks": [
      "completeness",
      "freshness",
      "availability",
      "consistency"
    ],
    "action_authorized": false
  },
  "policy": {
    "dataset_name": "Synthetic supplier delivery feed",
    "expected_rows": 12,
    "required_columns": [
      "record_id",
      "source",
      "updated_at",
      "amount",
      "status"
    ],
    "key_columns": [
      "record_id"
    ],
    "timestamp_column": "updated_at",
    "max_age_hours": 24,
    "future_tolerance_minutes": 5,
    "availability_window_hours": 720,
    "min_availability_attempts": 4,
    "evidence_context": {
      "purpose": "Illustrate declared acceptance criteria with synthetic observations.",
      "population": "Bundled synthetic examples only.",
      "sampling_method": "Constructed fixtures; not a random or production sample.",
      "reference_basis": "Synthetic expected records and rules."
    },
    "numeric_ranges": {
      "amount": {
        "min": 0,
        "max": 10000
      }
    },
    "allowed_values": {
      "status": [
        "ready",
        "pending",
        "delayed"
      ]
    },
    "thresholds": {
      "completeness": 95,
      "freshness": 95,
      "availability": 95,
      "consistency": 95
    }
  },
  "provenance": {
    "input_sha256": {
      "data": "b2f7a8ad6b5e1103cb6976ee665828fb10e002e803399c5e175bb06c01019d62",
      "fetch_attempts": "2842e5527de0095ffb0efb8304e5cdc5b4d0ce6e8b0d7bea5a94c6010d63c176"
    },
    "policy_sha256": "76c58bc4c86cebb811092c24bcb0729807610c183b8c5cedca7e3cbed46deea3",
    "source_verification": "not_performed",
    "context_verification": "not_performed",
    "generalization": "not_assessed"
  },
  "summary": {
    "rows": 0,
    "columns": 5,
    "observed_records": 0
  },
  "checks": {
    "completeness": {
      "label": "Completeness",
      "status": "unknown",
      "value": null,
      "unit": "%",
      "message": "The weaker of expected-record coverage and required-cell coverage; no rows means unknown.",
      "evidence": {
        "rows": 0,
        "observed_records": 0,
        "expected_rows": 12,
        "row_coverage_pct": null,
        "required_cell_coverage_pct": null,
        "present_required_cells": 0,
        "all_required_cells": 0,
        "missing_required_cells": 0
      },
      "threshold_status": "unknown",
      "evidence_status": "missing",
      "reason_codes": [
        "NO_OBSERVATIONS"
      ],
      "threshold": {
        "minimum": 95,
        "maximum": null,
        "basis": "point_estimate",
        "assessment_value": null
      }
    },
    "freshness": {
      "label": "Freshness",
      "status": "unknown",
      "value": null,
      "unit": "%",
      "message": "Share of rows with a valid, recent timestamp; unconfigured timestamps or no rows means unknown.",
      "evidence": {
        "timestamp_column": "updated_at",
        "max_age_hours": 24,
        "fresh_rows": 0,
        "stale_rows": 0,
        "invalid_timestamp_rows": 0,
        "all_rows": 0,
        "future_timestamp_rows": 0,
        "oldest_age_hours": null
      },
      "threshold_status": "unknown",
      "evidence_status": "missing",
      "reason_codes": [
        "NO_OBSERVATIONS"
      ],
      "threshold": {
        "minimum": 95,
        "maximum": null,
        "basis": "point_estimate",
        "assessment_value": null
      }
    },
    "availability": {
      "label": "Availability",
      "status": "unknown",
      "value": null,
      "unit": "%",
      "message": "Observed fetch success; the declared minimum count is a local guardrail, not proof of service uptime.",
      "evidence": {
        "attempts": 0,
        "successful_attempts": 0,
        "invalid_attempts": 0,
        "outside_window": 0,
        "window_hours": 720,
        "minimum_attempts": 4,
        "first_observed_at": null,
        "last_observed_at": null
      },
      "threshold_status": "unknown",
      "evidence_status": "missing",
      "reason_codes": [
        "NO_OBSERVATIONS"
      ],
      "threshold": {
        "minimum": 95,
        "maximum": null,
        "basis": "point_estimate",
        "assessment_value": null
      }
    },
    "consistency": {
      "label": "Consistency",
      "status": "unknown",
      "value": null,
      "unit": "%",
      "message": "Share of rows satisfying every configured rule; no rows or no rules means unknown.",
      "evidence": {
        "rows_failing_rules": 0,
        "all_rows": 0,
        "rows_passing_rules": 0,
        "violations": {
          "duplicate_keys": 0,
          "incomplete_keys": 0,
          "numeric_range:amount": 0,
          "allowed_values:status": 0
        },
        "sample_record_numbers": []
      },
      "threshold_status": "unknown",
      "evidence_status": "missing",
      "reason_codes": [
        "NO_OBSERVATIONS"
      ],
      "threshold": {
        "minimum": 95,
        "maximum": null,
        "basis": "point_estimate",
        "assessment_value": null
      }
    }
  },
  "findings": [],
  "notes": [
    "Thresholds express expectations; they do not prove that data represents reality.",
    "Evidence sufficiency means the declared local rules are satisfied, not external validity or authority to act.",
    "Input fingerprints identify supplied text; they do not verify source authenticity or completeness.",
    "Expected rows refer to this supplied extract. Filter the intended period before analysis.",
    "Availability measures supplied fetch observations, not time-based service uptime.",
    "Reports include aggregate evidence, column names and record numbers, not raw row values."
  ],
  "scenario": "unknown"
}
